{
  "version": "1.0",
  "mode": "E",
  "session_id": "s_demo_001",
  "created_at": "2026-05-17T19:50:00Z",
  "prd_path": "skills/prd-to-canvas/examples/ai-coach-demo/00-raw-prd.md",
  "design_source": "default",
  "iteration": 1,
  "decisions": [
    { "candidate_id": "c001", "verdict": "accept" },
    { "candidate_id": "c002", "verdict": "accept" },
    { "candidate_id": "c003", "verdict": "accept" },
    { "candidate_id": "c004", "verdict": "accept" },
    { "candidate_id": "c005", "verdict": "accept" },
    { "candidate_id": "c006", "verdict": "accept" },
    { "candidate_id": "c007", "verdict": "accept" },
    { "candidate_id": "c008", "verdict": "accept" },
    { "candidate_id": "c009", "verdict": "accept" },
    { "candidate_id": "c010", "verdict": "accept" },
    { "candidate_id": "c011", "verdict": "accept" },
    { "candidate_id": "c012", "verdict": "accept" },
    { "candidate_id": "c013", "verdict": "accept" },
    { "candidate_id": "c014", "verdict": "accept" },
    { "candidate_id": "c015", "verdict": "accept" },
    { "candidate_id": "c016", "verdict": "accept" },
    { "candidate_id": "c017", "verdict": "skip", "note": "保留 ASCII 流程图作为文字版，配合下面 c018 的 mermaid 图" },
    { "candidate_id": "c018", "verdict": "edit", "user_input": { "mermaid_kind": "flowchart LR" }, "note": "用 LR 横向布局比较省纵向空间" },
    { "candidate_id": "c019", "verdict": "accept" },
    { "candidate_id": "c020", "verdict": "accept" },
    { "candidate_id": "c021", "verdict": "accept" },
    { "candidate_id": "c022", "verdict": "accept" },
    { "candidate_id": "c023", "verdict": "accept" },
    { "candidate_id": "c024", "verdict": "accept" },
    { "candidate_id": "c025", "verdict": "accept" },
    { "candidate_id": "c026", "verdict": "accept" },
    { "candidate_id": "c027", "verdict": "accept" },
    { "candidate_id": "c028", "verdict": "accept" },
    { "candidate_id": "c029", "verdict": "accept" },
    { "candidate_id": "c030", "verdict": "accept" },
    {
      "candidate_id": "c031",
      "verdict": "edit",
      "user_input": {
        "status_codes_4xx_5xx": "401: {\"error\": \"unauthorized\", \"code\": \"AUTH_001\"}\n404: {\"error\": \"match_not_found\"}\n500: {\"error\": \"llm_timeout\", \"retry\": true}"
      },
      "note": "补全 4xx/5xx 响应样本"
    },
    { "candidate_id": "c032", "verdict": "accept" },
    { "candidate_id": "c033", "verdict": "accept" },
    {
      "candidate_id": "c034",
      "verdict": "edit",
      "user_input": {
        "status_codes_4xx_5xx": "404: {\"error\": \"hero_or_skill_not_found\"}"
      }
    },
    { "candidate_id": "c035", "verdict": "accept" },
    { "candidate_id": "c036", "verdict": "accept" },
    { "candidate_id": "c037", "verdict": "accept" },
    { "candidate_id": "c038", "verdict": "accept" },
    { "candidate_id": "c039", "verdict": "accept" },
    { "candidate_id": "c040", "verdict": "accept" },
    { "candidate_id": "c041", "verdict": "accept" },
    { "candidate_id": "c042", "verdict": "accept" },
    { "candidate_id": "c043", "verdict": "accept" },
    { "candidate_id": "c044", "verdict": "skip" },
    { "candidate_id": "c045", "verdict": "accept" },
    { "candidate_id": "c046", "verdict": "accept" },
    { "candidate_id": "c047", "verdict": "accept" },
    { "candidate_id": "c048", "verdict": "accept" },
    { "candidate_id": "c049", "verdict": "accept" },
    { "candidate_id": "c050", "verdict": "accept" },
    { "candidate_id": "c051", "verdict": "accept" },
    { "candidate_id": "c052", "verdict": "accept" },
    { "candidate_id": "c053", "verdict": "accept" },
    { "candidate_id": "c054", "verdict": "accept" },
    { "candidate_id": "c055", "verdict": "accept" },
    { "candidate_id": "c056", "verdict": "accept" },
    { "candidate_id": "c057", "verdict": "skip", "note": "保留 4 阶段文字描述，不用 mermaid（横排会更长）" },
    { "candidate_id": "c058", "verdict": "accept" },
    { "candidate_id": "c059", "verdict": "accept" },
    { "candidate_id": "c060", "verdict": "accept" },
    { "candidate_id": "c061", "verdict": "accept" },
    { "candidate_id": "c062", "verdict": "accept" },
    { "candidate_id": "c063", "verdict": "accept" },
    { "candidate_id": "c064", "verdict": "accept" },
    { "candidate_id": "c065", "verdict": "accept" },
    { "candidate_id": "c066", "verdict": "accept" },
    { "candidate_id": "c067", "verdict": "accept" },
    { "candidate_id": "c068", "verdict": "accept" },
    { "candidate_id": "c069", "verdict": "accept" },
    { "candidate_id": "c070", "verdict": "accept" },
    { "candidate_id": "c071", "verdict": "accept" },
    { "candidate_id": "c072", "verdict": "accept" },
    { "candidate_id": "c073", "verdict": "accept" }
  ],
  "global_options": {
    "add_canvas_only_suggestions": true,
    "preserve_original_b_mode": false
  }
}
